{
  "coverage_version": "1.0.0",
  "artifact_id": "Example.Order.Coverage",
  "content_version": "1.0.0",
  "model_ref": {
    "artifact_id": "Example.Order",
    "content_version": "1.0.0",
    "contract_version": "business-domain-model/1.0.0",
    "path": ".agents/skills/domain-model/examples/order/model.yaml",
    "digest": "sha256:0000000000000000000000000000000000000000000000000000000000000000"
  },
  "knowledge_ref": {
    "artifact_id": "Synthetic.OrderKnowledge",
    "content_version": "0.0.0",
    "contract_version": "5.0.0",
    "path": ".agents/skills/domain-model/examples/order/synthetic-knowledge.json",
    "digest": "sha256:cdbdeaae36eed54ec7208bf2324b2cc411d537fb40fa37beed07de35469bf0f5"
  },
  "scope_mode": "FULL_BASELINE",
  "question_scope_ids": [
    "K.Q.ORDER"
  ],
  "rule_coverage": [
    {
      "knowledge_rule_id": "K.SYNTHETIC.ORDER",
      "question_ids": [
        "K.Q.ORDER"
      ],
      "modeling_classification": [
        "CORE_STRUCTURE",
        "DOMAIN_DECISION"
      ],
      "reason": "订单和商户是稳定业务对象，订单归属是稳定关系，支付与配送共同形成可履约判断。",
      "model_refs": [
        "Order.Merchant",
        "Order.Order",
        "Order.PlacedWith",
        "Order.CanFulfill"
      ],
      "status": "MODELED",
      "gap_ids": [],
      "facets": {
        "scope": {
          "source_text": "商户订单履约判断。",
          "model_refs": [
            "Order.Order",
            "Order.Merchant"
          ],
          "handling": "MODELED",
          "explanation": "由订单和商户业务对象承接。"
        },
        "preconditions": {
          "source_text": "订单可识别，收到支付和配送信息。",
          "model_refs": [
            "Order.Order"
          ],
          "handling": "MODELED",
          "explanation": "订单身份及支付、配送事实承接前提。"
        },
        "conditions": {
          "source_text": "支付已确认且配送可用。",
          "model_refs": [
            "Order.CanFulfill"
          ],
          "handling": "MODELED",
          "explanation": "由订单可履约判断准则表达。"
        },
        "result": {
          "source_text": "订单是否可履约。",
          "model_refs": [
            "Order.CanFulfill"
          ],
          "handling": "MODELED",
          "explanation": "由业务判断结果表达。"
        },
        "exceptions": {
          "source_text": "任一条件明确不成立时不可履约。",
          "model_refs": [
            "Order.CanFulfill"
          ],
          "handling": "MODELED",
          "explanation": "由业务判断准则表达。"
        },
        "missing_evidence": {
          "source_text": "未知支付或配送信息不默认允许。",
          "model_refs": [
            "Order.CanFulfill"
          ],
          "handling": "MODELED",
          "explanation": "由 UNKNOWN 行为表达。"
        },
        "effective_period": {
          "source_text": "对本次订单履约判断时点有效。",
          "model_refs": [
            "Order.CanFulfill"
          ],
          "handling": "MODELED",
          "explanation": "本例不建额外技术状态机。"
        }
      }
    }
  ],
  "question_coverage": [
    {
      "question_id": "K.Q.ORDER",
      "question": "什么时候允许订单履约？",
      "status": "MODELED",
      "model_refs": [
        "Order.Order",
        "Order.CanFulfill"
      ],
      "gap_ids": [],
      "rule_ids": [
        "K.SYNTHETIC.ORDER"
      ],
      "case_ids": [],
      "answer": "支付已确认且配送可用时可以履约；必要事实未知时保持 UNKNOWN。",
      "reason": "业务对象和业务判断已完整表达合成知识。"
    }
  ],
  "case_coverage": [],
  "upstream_issue_bindings": [],
  "model_issues": []
}
